{
  "$schema": "./contract.schema.json",
  "_comment": "Draft only. /contract must resolve all null decision fields before attestation.",
  "version": "2",
  "scope": "",
  "created": "",
  "is_frontend": null,
  "is_backend": null,
  "is_architecturally_complex": null,
  "linked_issue": null,
  "linked_plan": "task_plan.md",
  "linked_cjm": null,
  "linked_product_brief": "product_brief.md",
  "user_flow": {
    "jtbd": "",
    "primary_path": [],
    "error_paths": []
  },
  "integrations": {
    "data_flow": "",
    "frontend_calls": [],
    "backend_endpoints": [],
    "schema_changes": [],
    "external_services": []
  },
  "criteria": [],
  "out_of_scope": [],
  "judge_required": true,
  "grace_mode": "pending"
}
